{
  "$schema": "https://json-schema.org/draft/2020-12/schema",
  "$id": "service_credential.v1",
  "title": "service_credential",
  "type": "object",
  "required": [
    "id",
    "principal_id",
    "kind",
    "secret_ref_id",
    "not_before",
    "expires_at",
    "rotation_policy_id",
    "status"
  ],
  "additionalProperties": false,
  "properties": {
    "id": { "type": "string" },
    "principal_id": { "type": "string" },
    "kind": { "type": "string", "enum": ["hmac", "api_key"] },
    "secret_ref_id": { "type": "string" },
    "not_before": { "type": "string", "format": "date-time" },
    "expires_at": { "type": "string", "format": "date-time" },
    "rotation_policy_id": { "type": "string" },
    "status": { "type": "string", "enum": ["active", "disabled"] }
  }
}
