[
  {
    "id": "svc:cred:cp-hmac-v1",
    "principal_id": "svc:cp",
    "kind": "hmac",
    "secret_ref_id": "sec:ref:s2s_cp_hmac_v1",
    "not_before": "2026-02-15T00:00:00Z",
    "expires_at": "2026-03-17T00:00:00Z",
    "rotation_policy_id": "sec:pol:rotation-30d",
    "status": "active"
  },
  {
    "id": "svc:cred:ci-hmac-v1",
    "principal_id": "svc:ci",
    "kind": "hmac",
    "secret_ref_id": "sec:ref:s2s_ci_hmac_v1",
    "not_before": "2026-02-15T00:00:00Z",
    "expires_at": "2026-03-17T00:00:00Z",
    "rotation_policy_id": "sec:pol:rotation-30d",
    "status": "active"
  },
  {
    "id": "svc:cred:ops-hmac-v1",
    "principal_id": "svc:ops",
    "kind": "hmac",
    "secret_ref_id": "sec:ref:s2s_ci_hmac_v1",
    "not_before": "2026-02-15T00:00:00Z",
    "expires_at": "2026-03-17T00:00:00Z",
    "rotation_policy_id": "sec:pol:rotation-30d",
    "status": "active"
  }
]
